name,team,battingStyle,bowlingStyle,playingRole,description
Nurul Hasan,Bangladesh,Right hand Bat,,Wicketkeeper Batter,"Nurul Hasan, who made his first-class debut in 2011, is one of a whole host of talented Bangladesh wicketkeepers who had to wait his turn to play international cricket. It wasn't entirely his fault though. For 30 years, the position behind the stumps was the domain of Khaled Mashud or Mushfiqur Rahim. "
Mosaddek Hossain,Bangladesh,Right hand Bat,Right arm Offbreak,Middle order Batter,"Mosaddek Hossain, who comes from a family of cricketers, snuck up on Bangladesh cricket's consciousness during the 2013 Dhaka Premier Division Cricket League, helping Abahani Limited stay afloat in a disastrous campaign. He struck a century and three fifties, before having to head to the Bangladesh Under-19 training camp ahead of the 2014 World Cup in the UAE. The opportunity to get out of age-group cricket quite early proved to be an important milestone in his development. "
Taskin Ahmed,Bangladesh,Left hand Bat,Right arm Fast,Bowler,"Even before he was anywhere near making his international debut, Taskin Ahmed became an internet sensation. A video of his spell against England Under-19s in 2012 found its way to Youtube, and the sight of a Bangladeshi fast bowler ripping it past batsman and hitting the wicketkeeper's gloves quite hard and high made people curious."
Hasan Mahmud,Bangladesh,Right hand Bat,Right arm Medium,Bowler,"Hasan Mahmud is one among a group of young pace bowlers who have given hope of a fast bowling uprising in Bangladesh, after decades of reliance on spin. Mahmud is still at a very early stage of his career, having just played a single T20I for Bangladesh, and earned a maiden call-up in the ODI side in January 2021, but already he has earned plenty of praise from Bangladesh's coaches for his ability to bowl fast, full and accurately. "
Shariz Ahmad,Netherlands,Left hand Bat,Legbreak Googly,Bowler,
Shakib Al Hasan,Bangladesh,Left hand Bat,Slow Left arm Orthodox,Allrounder,"When the annals of Bangladesh cricket are sifted by future generations, Shakib Al Hasan will emerge and re-emerge as the greatest cricketer of its first two decades. As a bowler, Shakib is accurate, consistent and canny; aggression and a wide range of strokes are the keys to his batting. Even more importantly, he has self-belief and an excellent temperament, unflustered by the big occasion and ready to do battle against the top teams."
Mustafizur Rahman,Bangladesh,Left hand Bat,Left arm Fast medium,Bowler,"Mustafizur Rahman is a left-arm pace bowler who came to Dhaka to try out for a fast-bowling camp in 2012, after he had impressed in an Under-17 tournament in Satkhira, some 300km from Dhaka. He got admitted to the BCB's pace foundation and soon caught the coaches' attention to make the Bangladesh Under-19 side for the 2014 World Cup. "
Fionn Hand,Ireland,Right hand Bat,Right arm Medium,Bowling Allrounder,
George Munsey,Scotland,Left hand Bat,Right arm Medium fast,Opening Batter,"Known as the reverse-sweeping demon of the Associate world, George Munsey's path to the Scotland national team is as unorthodox as his trademark shot. Born and raised in Oxford, Munsey had dreams of becoming a professional golfer and it was a golf scholarship to the Loretto School, just outside Edinburgh, that brought him to Scotland at age 13. "
Michael Jones,Scotland,Right hand Bat,Right arm Offbreak,Top order Batter,Durham Academy youngster Michael Jones hit 87 in a fine debut for Scotland against Ireland in Dubai as his more experienced team-mates toiled. That breakthrough was followed by a first team debut for Durham against Derbyshire at Chesterfield in June of that year.
Matthew Cross,Scotland,Right hand Bat,,Wicketkeeper Batter,"A wicketkeeper-batter from Aberdeen, Matthew Cross got into the Scotland set-up at U-13 level, progressed up the ranks, making a good impression as vice-captain for the U-19s in the 2012 World Cup in Australia, and then broke into the senior side the following year."
Richie Berrington(c),Scotland,Right hand Bat,Right arm Medium fast,Top order Batter,"Richie Berrington powered Scotland to their long-awaited first victory over an ICC Full Member when his century, which was made in only 56 balls and included five sixes, set-up victory over Bangladesh in a T20 international in July 2012"
Calum MacLeod,Scotland,Right hand Bat,"Right arm Medium fast, Right arm Offbreak",Top order Batter,"Calum MacLeod won a place in Scottish sport folklore when he struck a century that helped Scotland beat the world's No. 1 ODI side at the time, England, in a game in Edinburgh in 2018. That year, he also produced an unbeaten 157 against Afghanistan in a World Cup Qualifier match in Bulawayo, where he expertly dealt with legspinner Rashid Khan, liberally employing a sweep shot that he put down to his time spent playing hockey. Those knocks made him a slam-dunk choice at the end of 2018 to claim the ICC Associate Player of the Year Award, making him the second Scotland player to do so following Preston Mommsen in 2014. "
Michael Leask,Scotland,Right hand Bat,Right arm Offbreak,Allrounder,"Michael Leask is an explosive batsman from Aberdeen. He showed as much when he smeared five sixes during a memorable 16-ball 42 in an ODI against England in May 2014. But he has been hampered by inconsistency, and he only mustered 56 runs at an average of 9.33 during the World Cup Qualifiers in 2014. Leask also bowls useful off-spin, taking three wickets in Scotland's win over Tasmania in their World Cup acclimatisation tour in autumn 2014.
Leask played a solitary first-class game for Northants in a tour match against New Zealand A in 2014. He moved on to Somerset ahead of the 2016 season with Somerset's director of cricket Matt Maynard describing him as a ""feisty cricketer"". A scattering of T20 matches were his only outings in his debut season.

ESPNcricinfo staff"
Chris Greaves,Scotland,Right hand Bat,Legbreak,Bowler,
Shamarh Brooks,West Indies,Right hand Bat,Legbreak,Top order Batter,"In full flow, Shamarh Brooks is all elegance. He drives mercilessly through the off side and often finishes his flicks standing on one leg. But it took four innings in Tests before these skills were visible."
Mark Watt,Scotland,Left hand Bat,Slow Left arm Orthodox,Bowler,"Mark Watt drew attention to himself in no uncertain terms when he took three wickets at The Grange as Scotland overturned England, who were top of the worlds rankings at the time, in an ODI for the first time."
Brad Wheal,Scotland,Right hand Bat,Right arm Fast medium,Bowler,"Brad Wheal, a right-handed batsman and right-arm pace bowler, was born in Durban, South Africa but holds a British passport and moved to England with the encouragement of Hampshire's head coach at the time, Dale Benkenstein, who had spotted him playing for Natal Under-19. "
Josh Davey,Scotland,Right hand Bat,Right arm Medium fast,Bowler,"Josh Davey's seam-bowling talent was recognised when Middlesex gave him his county debut at the age of 19. But, although he was involved with the county for four years, the seam-bowling allrounder failed to push on, and he was released at the end of 2013 and moved west to Somerset. "
Safyaan Sharif,Scotland,Right hand Bat,Right arm Medium fast,Bowler,"Born in Huddersfield, Safyaan Sharif made his debut for Scotland at 20 after eye-catching performances for Dunfermline and Scotland U-19s, and took 4 for 27 against the Netherlands in his first ODI in 2011. With 14 wickets at 23.92 apiece, his fast-medium bowling played an important part in Scotland's success in the World Cup Qualifiers in New Zealand in 2014. "
Quinton de Kock,South Africa,Left hand Bat,,Wicketkeeper Batter,"Quinton de Kock's fearless striking and handy glovework earned him comparisons to greats of the game like Adam Gilchrist and Mark Boucher early in his career. By 21, he shared the record for the most successive ODI centuries - three - before it was bettered by Kumar Sangakkara. A year later, he had established himself in all three formats for South Africa. "
Temba Bavuma(c),South Africa,Right hand Bat,Right arm Medium,Middle order Batter,"From the same street in Langa, a township outside Cape Town, where Thami Tsolekile and Malusi Siboto were raised, came Temba Bavuma. Unlike the wicketkeeper-batsman and medium-pacer, Bavuma is a specialist batsman and the first black African batsman picked in South Africa's Test squad. "
Kagiso Rabada,South Africa,Left hand Bat,Right arm Fast,Bowler,"A strapping, genuine quick who regularly bowls in the 140-150kph range, Kagiso Rabada is the most exciting talent to emerge from South Africa in the post No.1 Test ranking era. Before he had turned 21, Rabada had already established himself as a potential leader of the attack. "
Wayne Parnell,South Africa,Left hand Bat,Left arm Medium fast,Bowler,"An aggressive left-handed seamer, who bowls with as much venom as he bats, Wayne Parnell was earmarked for success early and spent the next few years trying to get there. Inconsistency and injury were his nemeses, however, and that led to him abandoning international cricket with South Africa and signing a three-year deal with Worcestershire as a Kolpak after the 2018 English season."
Lungi Ngidi,South Africa,Right hand Bat,Right arm Fast medium,Bowler,"A tall, imposing paceman, Lungi Ngidi can reach speeds in the 140s kph and is as comfortable opening the bowling as he is at the death, making him one of South Africa's most promising prospects. Ngidi was schooled at Kwa-Zulu Natal's Hilton College and was involved at every provincial age-group level from Under-13 upwards. "
Keshav Maharaj,South Africa,Right hand Bat,Slow Left arm Orthodox,Bowler,"A left-arm spinner from Northwood Boys High, the alma mater of Shaun Pollock, Keshav Maharaj emerged at a time when South Africa began to take spin seriously. For several seasons in the mid 2010s, spinners were among the leading wicket-takers in South Africa's first-class competition. Maharaj was among them in the 2014-15 and 2015-16 seasons and was rewarded with an international call-up the following summer."
Anrich Nortje,South Africa,Right hand Bat,Right arm Fast,Bowler,"Anrich Nortje is a genuine quick who has been described as ""extremely exciting"" by none other than Dale Steyn. Like Steyn, Nortje is not a product of a big city but comes from the town of Uitenhage, north of Port Elizabeth, which is home to the largest Volkswagen factory in the African continent. It's hardly surprising then, that Nortje is well-acquainted with speed. He regularly sends the speed gun over 150kph and has a fearsome bouncer. "
Timm van der Gugten,Netherlands,Right hand Bat,Right arm Fast medium,Bowler,"Timm van der Gugten, born in Sydney, made his first-class debut for New South Wales in November 2011. He was called up to the Netherlands the following year for World Twenty20 in the West Indies and made his debut at 21. He also represented the Netherlands at two subsequent World Twenty20s where he has carried one of their most potent threats. "
Finn Allen,New Zealand,Right hand Bat,,Top order Batter,
Devon Conway,New Zealand,Left hand Bat,Right arm Medium,Wicketkeeper Batter,
Kane Williamson(c),New Zealand,Right hand Bat,Right arm Offbreak,Top order Batter,"By the time Kane Williamson is finished with playing cricket, it is probable that he will be New Zealand's greatest batsman. Even Martin Crowe endorsed that view. But he may also finish as one of the game's most loved global figures. Williamson is ambidextrous, bats right-handed in the top order across formats, and has become a pillar of the New Zealand side since he made his debut in 2010."
Glenn Phillips,New Zealand,Right hand Bat,Right arm Offbreak,Wicketkeeper Batter,"Glenn Phillips is a top-order wicketkeeper-batsman who has impressed in white-ball cricket during the early stages of his career. Born in South Africa, he moved to New Zealand with his family at the age of five and has come through the cricket set-up in Auckland. He made his List A debut at the age of 18 before playing in the 2016 Under-19 World Cup. He really started to turn heads, however, during the 2016-17 Super Smash when he was the tournament's leading scorer with 369 runs, including an innings of 116 off 57 balls. He was called into the New Zealand T20 squad to face South Africa in February 2017 after an injury to Martin Guptill.
ESPNcricinfo staff"
James Neesham,New Zealand,Left hand Bat,Right arm Medium fast,Batting Allrounder,"Allrounder, and Twitter star, Jimmy Neesham went from the brink of retirement from cricket to almost delivering New Zealand the 2019 World Cup. In the tournament he was outstanding with bat and ball then in the final against England claimed three wickets and produced the final-ball run out to tie the scores after 50 overs. He was entrusted with the bat in the Super Over and scored 13 off 5 balls including a huge six off Jofra Archer. He was at the non-striker's end for the last ball when Martin Guptill was run out coming back for a second run that would have won New Zealand the World Cup. "
Tim David,Australia,Right hand Bat,Right arm Offbreak,Middle order Batter,"Mumbai Indians' decision to sign Tim David for INR 8.25 crore (AUD 1.5 million) at the 2022 IPL auction confirmed two things. Firstly, that the game's formats had diverged so much that a man without a state contract or even a first-class appearance to his name could be worth such a sum; and secondly, that David had become one of the world's most sought-after T20 finishers over the previous 12 months."
Matthew Wade,Australia,Left hand Bat,Right arm Medium,Wicketkeeper Batter,It has been a career of reinvention for Matthew Wade as he went from Test wicketkeeper to specialist middle-order batsman to T20I World Cup winning wicketkeeper/finisher via a prolific run in domestic cricket when it appeared his international days were over.
Adam Zampa,Australia,Right hand Bat,Legbreak Googly,Bowler,"An energetic and competitive legspinner, Adam Zampa emerged in Australia's limited-overs squads in 2016 after a successful summer for South Australia and the Melbourne Stars. In T20, especially, he has proven a hard man to get away, with subtle changes of pace and variations, including a wrong'un and straight ball making up for a lack of prodigious turn. He's a (mullet-wearing) colourful character off the field, but in contrast, his bowling, focusing on control, is clinical."
Trent Boult,New Zealand,Right hand Bat,Left arm Fast medium,Bowler,"Rated as one half of the best new-ball pair in New Zealand history by Sir Richard Hadlee, Trent Boult is a left-arm quick who presents a significant threat to batsmen around the world with an ability to move the ball both ways even in unresponsive conditions."
Tim Southee,New Zealand,Right hand Bat,Right arm Medium fast,Bowler,"Tim Southee, a right-arm swing bowler, burst upon the international scene in great style. He was still only 19, with only one T20I cap behind him, and fresh from a Player-of-the-Tournament performance at the 2008 Under-19 World Cup when he was handed a Test debut against England in Napier. Southee responded with 5 for 55 before smashing 77 off 40 balls in the second innings with nine sixes."
Mitchell Santner,New Zealand,Left hand Bat,Slow Left arm Orthodox,Bowling Allrounder,"A left-handed batsman and left-arm spinner, Mitchell Santner was first elevated to the New Zealand side after a promising 2014-15 domestic season. "
Lockie Ferguson,New Zealand,Right hand Bat,Right arm Fast,Bowler,"A right-arm quick with a good bouncer, it is Lockie Ferguson's speed that made a breakout star at the 2019 World Cup in England. Regularly hitting 150kph, Ferguson's raw speed bowling first change yielded 21 wickets at just 19.47 and an economy rate of 4.88. He finished second on the tournament wicket tally behind Mitchell Starc. He was rewarded with being named in the ICC's team of the tournament alongside skipper Kane Williamson. "
Ish Sodhi,New Zealand,Right hand Bat,Legbreak,Bowler,"There is little in Ish Sodhi's statistics to suggest he is an international-quality legspinner, but New Zealand's selectors have seen enough in his aggressive approach and keen attitude to hand him a Test debut after only one full season of first-class cricket. Known chiefly for the turn he generates and the flight he fearlessly trusts, Sodhi's journey to top-level cricket has been a triumph of determination over significant odds."
Aryan Lakra,U.A.E.,Left hand Bat,Slow Left arm Orthodox,Bowler,
Stephan Myburgh,Netherlands,Left hand Bat,Right arm Offbreak,Opening Batter,
Brandon Glover,Netherlands,Right hand Bat,Right arm Fast,Bowler,"A Dutch-South African fast bowler, Brandon Glover left South Africa after a call from Netherlands coach Ryan Campbell, who convinced him to put his Dutch passport to good use after he had finished his accounting degree. He had played Under-19 cricket for South Africa, but was enticed by the opportunity to play regular international cricket, and starred at the T20 World Cup Qualifier in late 2019, bowling hard lengths into the pitch at high pace."
Shoriful Islam,Bangladesh,Left hand Bat,Left arm Medium fast,Bowler,"At 6ft three inches, Shoriful Islam became a left-arm pace sensation almost overnight, when he starred in Bangladesh's 2020 Under-19 World Cup triumph. He took nine wickets, but it was his aggression and pace in the knockout games against South Africa, New Zealand and (in the final against) India that stood out."
Daryl Mitchell,New Zealand,Right hand Bat,Right arm Medium,Allrounder,"Daryl Mitchell was called into New Zealand's Test team in late 2019 as a replacement for the injured Colin de Grandhomme. He impressed, too, making an assured 73 against England in his first innings and bowling with good control on a sluggish surface at his home ground, Hamilton. He had made his international debut against India in a T20I in February of that year."
Kasun Rajitha,Sri Lanka,Right hand Bat,Right arm Medium fast,Bowler,"Virtually unheard of before 2015, the first inkling of right-arm seamer Kasun Rajitha's potential came during a three-dayer against the touring Indians in August of that year. He took 5 for 68 on a spicy Khettarama deck in that match, dismissing Shikhar Dhawan, Virat Kohli and Rohit Sharma in a single spell, before claiming Kohli's wicket in the second innings as well."
Deepak Hooda,India,Right hand Bat,Right arm Offbreak,Allrounder,"An allrounder who can bat in any position, Deepak Hooda also bowls offbreaks, offers plenty of athleticism as a boundary fielder, and is an asset in any T20 side. His big hitting as a 19-year-old in his debut IPL season, in 2015, earned with the nickname ""Hurricane Hooda"", but more importantly, got him a Rs 4.2 crore (US$ 622,000 approx) contract with Sunrisers Hyderabad at the next auction. "
Rilee Rossouw,South Africa,Left hand Bat,Right arm Offbreak,Top order Batter,"A stylish top-order player with an elegant and authoritative drive, Rilee Rossouw has been a high-impact batter for South Africa in limited-overs cricket.  "
Aiden Markram,South Africa,Right hand Bat,Right arm Offbreak,Opening Batter,"The first South Africa captain to win a World Cup, albeit at age-group level, Aiden Markram announced himself as champion material early. He led South Africa's Under-19s to World Cup glory in 2014 and was also their leading run-scorer and third overall. It took him another three years to break into the senior side, but when he did, he made an impact right away with 97, 143 and 125 in his first three Tests, at home against Bangladesh and Zimbabwe. "
David Miller,South Africa,Left hand Bat,Right arm Offbreak,Middle order Batter,"A hard-hitting left-hander with a penchant for clearing the boundary, David Miller made famous the phrase ""If it's in the arc, it's out the park."" Miller is a self-styled finisher who is strong off the front and back foot and eager to swing his arms, as well as a gun fielder. "
Tristan Stubbs,South Africa,Right hand Bat,Right arm Offbreak,Wicketkeeper Batter,
Nasum Ahmed,Bangladesh,Left hand Bat,Slow Left arm Orthodox,Bowler,
Mohammad Haris,Pakistan,Right hand Bat,Right arm Offbreak,Middle order Batter,
Mohammad Wasim,Pakistan,Right hand Bat,Right arm Fast medium,Allrounder,
Ebadot Hossain,Bangladesh,Right hand Bat,Right arm Fast medium,Bowler,"Ebadat Hossain Chowdhury's journey from being a volleyball player for Bangladesh Air Force to becoming a Test cricketer in February 2019 was a short, and interesting, one. Living in their barracks, Ebadat dreamt of bowling like Brett Lee one day. His dream came true when he took part in the 2016 Robi Pacer Hunt in Faridpur, crisscrossing 342km southwest from his hometown Sylhet. He was one of the top three bowlers, and was duly picked by the scouts to a training camp in Dhaka."
Heinrich Klaasen,South Africa,Right hand Bat,Right arm Offbreak,Wicketkeeper Batter,"A clean-hitting, wicketkeeper batsman, Heinrich Klaasen emerged on the scene at the same time that Quinton de Kock nailed down a place in the South African team, across all formats. As someone who had always combined the disciplines of batting and glovework, Klaasen hoped to make it in either skill and establish himself as all-round option, if required."
Brad Evans,Zimbabwe,Right hand Bat,Right arm Fast,Allrounder,
Fakhar Zaman,Pakistan,Left hand Bat,Slow Left arm Orthodox,Opening Batter,"Born in Mardan, where the standard of batsmanship will always be measured by arguably Pakistan's greatest Test batsman Younis Khan, Fakhar Zaman has been on Pakistan's thankless domestic circuit for over five years with almost no attention. A left-handed opener with an unusually high backlift, Zaman relies on timing for his runs, which he's made plenty of. This is illustrated by his domestic average (42 in first class cricket and 49 in List A). But it wasn't until the Quaid-e-Azam trophy in 2016-17 that his form began to be noticed. Zaman scored 663 runs in the competition at an average of 51, including 170 in the second innings of the final, a game dominated by the twin centuries of former Pakistan captain Salman Butt."
Cameron Green,Australia,Right hand Bat,Right arm Fast medium,Batting Allrounder,"Contracted to Western Australia as a schoolboy, Cameron Green took 5 for 24 on first-class debut against Tasmania in February 2017 as a 17-year-old. He was selected initially for his bowling given his 200cm frame and his ability to deliver fast outswing but was plagued by stress fractures. However, throughout his junior days with Subiaco-Floreat and WA's junior teams his technically sound batting and an unquenchable thirst for scoring runs saw him emerge as a genuine allrounder of rare ability. "
Steven Smith,Australia,Right hand Bat,Legbreak Googly,Middle order Batter,"In a career of twists and turns, Steven Smith started out as a legspinner and become Australia's best batter since Sir Donald Bradman, either side of having his career derailed by a ball-tampering scandal that saw him stripped of the captaincy and banned for 12 months."
Matthew Wade(c),Australia,Left hand Bat,Right arm Medium,Wicketkeeper Batter,It has been a career of reinvention for Matthew Wade as he went from Test wicketkeeper to specialist middle-order batsman to T20I World Cup winning wicketkeeper/finisher via a prolific run in domestic cricket when it appeared his international days were over.
Kane Richardson,Australia,Right hand Bat,Right arm Fast medium,Bowler,"A pace bowler who has often been on the fringes of Australia's ODI and T20 teams, Kane Richardson is know for his skills at the death and has an excellent yorker. Although he has struggled to gain much traction at first-class level for South Australia, Richardson is very effective in the shorter forms and in 2019 was a late addition to the World Cup squad."
Gulbadin Naib,Afghanistan,Right hand Bat,Right arm Medium fast,Batting Allrounder,"Gulbadin Naib's first love in the sporting world was amateur bodybuilding, not cricket. When he eventually did take the game up, however, he progressed quickly through Afghanistan's age group sides as a batting allrounder and was the youngest member of the team that won the Division Five tournament in 2008 - the first stepping stone to the full world stage."
Darwish Rasooli,Afghanistan,Right hand Bat,Right arm Offbreak,Top order Batter,
Naveen-ul-Haq,Afghanistan,Right hand Bat,Right arm Medium fast,Bowler,
Rishabh Pant,India,Left hand Bat,,Wicketkeeper Batter,"A match-turning, swashbuckling batter-keeper in the Adam Gilchrist mould, Rishabh Pant has had a starring role in more than a handful of India's biggest Test matches in his first few years in the team."
Tony Munyonga,Zimbabwe,Right hand Bat,Right arm Offbreak,Allrounder,
Wellington Masakadza,Zimbabwe,Left hand Bat,Slow Left arm Orthodox,Bowler,
Tabraiz Shamsi,South Africa,Right hand Bat,Left arm Wrist spin,Bowler,"A left-arm wristspin bowler with ample variations and a good googly, Tabraiz Shamsi emerged as South Africa were starting to warm to the wave of spinners being produced at domestic levels, although it took a while for him to come through. "
Phil Salt,England,Right hand Bat,Right arm Offbreak,Wicketkeeper Batter,"Phil Salt's fearless ball-striking at the top of the Sussex order earned him attention from across the global T20 circuit and a maiden England call-up in 2019, though he was made to wait until 2021 for his debut when he performed a passable impression of Jason Roy in the Covid-hit ODI series against Pakistan."
Chris Jordan,England,Right hand Bat,Right arm Fast medium,Bowler,"Chris Jordan, a fast bowler with a level-headed calmness and a fearsome yorker, found his niche as a death specialist in T20 cricket for England after initially breaking through as a bowling allrounder in Tests and ODIs. "
